{
  "schema": "stpd/human-collection-campaign-v1",
  "campaign_id": "human-combat-smoke-2026-08",
  "collection_profile_id": "human-mac-combat-v1",
  "target_accepted_records": 1500,
  "scope": "ordinary_combat_play_card_and_end_turn",
  "allowed_workers": [
    "human-001",
    "human-002",
    "human-003",
    "human-004",
    "human-005",
    "human-006",
    "human-007",
    "human-008"
  ],
  "created_at": "2026-08-23T00:00:00Z"
}
