{
  "schema": "stpd/human-collection-campaign-v1",
  "campaign_id": "human-windows-combat-smoke-2026-08-v2",
  "collection_profile_id": "human-windows-combat-v2",
  "target_accepted_records": 1500,
  "scope": "ordinary_combat_play_card_and_end_turn",
  "allowed_workers": [
    "human-win-001"
  ],
  "created_at": "2026-08-23T07:18:12Z"
}
